{
  "schemaVersion": "jovra.room.device-status/1",
  "sessionId": "sample-jon-alex",
  "hostEpoch": 3,
  "deviceId": "c2",
  "captureInstanceId": "sample-c2-take1",
  "segmentId": "s1",
  "deviceSeq": 11,
  "captureState": "Recording",
  "captureRole": "camera",
  "lastReportedElapsedMs": 753000,
  "observations": {
    "storageFreeBytes": 41000000000,
    "estimatedMinutesLeft": 182,
    "batteryPercent": 71,
    "charging": false,
    "lowPowerMode": false,
    "thermal": "fair"
  }
}
